{
  "$schema": "https://json-schema.org/draft/2020-12/schema",
  "$id": "https://ai-assembly-line.local/contracts/collaboration_state.schema.json",
  "title": "CollaborationState",
  "type": "object",
  "additionalProperties": false,
  "required": [
    "schema_version",
    "workspace_id",
    "actors",
    "task_assignments",
    "task_claims",
    "artifact_submissions",
    "reviews",
    "audit_events"
  ],
  "properties": {
    "schema_version": {
      "type": "string",
      "minLength": 1
    },
    "workspace_id": {
      "type": "string",
      "pattern": "^[a-z0-9][a-z0-9\\-]*$"
    },
    "generated_from": {
      "type": "string",
      "minLength": 1
    },
    "actors": {
      "type": "array",
      "items": { "$ref": "#/$defs/actor" }
    },
    "task_assignments": {
      "type": "array",
      "items": { "$ref": "#/$defs/task_assignment" }
    },
    "task_claims": {
      "type": "array",
      "items": { "$ref": "#/$defs/task_claim" }
    },
    "artifact_submissions": {
      "type": "array",
      "items": { "$ref": "#/$defs/artifact_submission" }
    },
    "reviews": {
      "type": "array",
      "items": { "$ref": "#/$defs/review" }
    },
    "audit_events": {
      "type": "array",
      "items": { "$ref": "#/$defs/audit_event" }
    }
  },
  "$defs": {
    "actor": {
      "type": "object",
      "additionalProperties": false,
      "required": ["actor_id", "display_name", "kind", "status"],
      "properties": {
        "actor_id": {
          "type": "string",
          "pattern": "^[a-z0-9][a-z0-9\\-]*$"
        },
        "display_name": {
          "type": "string",
          "minLength": 1
        },
        "kind": {
          "type": "string",
          "enum": ["human", "web_ai", "local_ai", "service"]
        },
        "status": {
          "type": "string",
          "enum": ["active", "inactive", "blocked"]
        },
        "notes": {
          "type": "string"
        }
      }
    },
    "task_assignment": {
      "type": "object",
      "additionalProperties": false,
      "required": ["task_id", "status", "updated_at"],
      "properties": {
        "task_id": {
          "type": "string",
          "pattern": "^[A-Za-z0-9][A-Za-z0-9\\-]*$"
        },
        "assigned_to": {
          "type": ["string", "null"],
          "pattern": "^[a-z0-9][a-z0-9\\-]*$"
        },
        "assignee_type": {
          "type": "string",
          "enum": ["human", "web_ai", "local_ai", "service", "unassigned"]
        },
        "assignee_label": {
          "type": "string"
        },
        "status": {
          "type": "string",
          "enum": ["unclaimed", "claimed", "in_progress", "review", "done", "blocked", "released"]
        },
        "claimed_at": {
          "type": "string",
          "format": "date-time"
        },
        "proof": {
          "type": "array",
          "items": { "$ref": "#/$defs/proof_ref" }
        },
        "notes": {
          "type": "string"
        },
        "updated_at": {
          "type": "string",
          "format": "date-time"
        }
      }
    },
    "proof_ref": {
      "type": "object",
      "additionalProperties": false,
      "required": ["kind", "summary"],
      "properties": {
        "kind": {
          "type": "string",
          "enum": ["command_output", "test_output", "screenshot", "log", "file", "manual_note", "task_run"]
        },
        "path": {
          "type": "string",
          "minLength": 1
        },
        "summary": {
          "type": "string",
          "minLength": 1
        },
        "status": {
          "type": "string",
          "enum": ["pending", "passed", "failed", "accepted", "needs_review"]
        },
        "recorded_at": {
          "type": "string",
          "format": "date-time"
        }
      }
    },
    "task_claim": {
      "type": "object",
      "additionalProperties": false,
      "required": ["claim_id", "task_id", "actor_id", "status", "claimed_at"],
      "properties": {
        "claim_id": {
          "type": "string",
          "pattern": "^[a-z0-9][a-z0-9\\-]*$"
        },
        "task_id": {
          "type": "string",
          "pattern": "^[A-Za-z0-9][A-Za-z0-9\\-]*$"
        },
        "actor_id": {
          "type": "string",
          "pattern": "^[a-z0-9][a-z0-9\\-]*$"
        },
        "status": {
          "type": "string",
          "enum": ["claimed", "in_progress", "blocked", "submitted", "released"]
        },
        "claimed_at": {
          "type": "string",
          "format": "date-time"
        },
        "released_at": {
          "type": "string",
          "format": "date-time"
        },
        "notes": {
          "type": "string"
        }
      }
    },
    "artifact_submission": {
      "type": "object",
      "additionalProperties": false,
      "required": ["submission_id", "task_id", "actor_id", "artifact_paths", "status", "submitted_at"],
      "properties": {
        "submission_id": {
          "type": "string",
          "pattern": "^[a-z0-9][a-z0-9\\-]*$"
        },
        "task_id": {
          "type": "string",
          "pattern": "^[A-Za-z0-9][A-Za-z0-9\\-]*$"
        },
        "actor_id": {
          "type": "string",
          "pattern": "^[a-z0-9][a-z0-9\\-]*$"
        },
        "artifact_paths": {
          "type": "array",
          "minItems": 1,
          "items": { "type": "string", "minLength": 1 }
        },
        "summary": {
          "type": "string"
        },
        "proof": {
          "type": "array",
          "items": { "$ref": "#/$defs/proof_ref" }
        },
        "status": {
          "type": "string",
          "enum": ["submitted", "needs_revision", "accepted", "rejected"]
        },
        "submitted_at": {
          "type": "string",
          "format": "date-time"
        }
      }
    },
    "review": {
      "type": "object",
      "additionalProperties": false,
      "required": ["review_id", "submission_id", "reviewer_actor_id", "status", "findings"],
      "properties": {
        "review_id": {
          "type": "string",
          "pattern": "^[a-z0-9][a-z0-9\\-]*$"
        },
        "submission_id": {
          "type": "string",
          "pattern": "^[a-z0-9][a-z0-9\\-]*$"
        },
        "reviewer_actor_id": {
          "type": "string",
          "pattern": "^[a-z0-9][a-z0-9\\-]*$"
        },
        "status": {
          "type": "string",
          "enum": ["pending", "approved", "changes_requested", "rejected"]
        },
        "findings": {
          "type": "array",
          "items": { "type": "string", "minLength": 1 }
        },
        "reviewed_at": {
          "type": "string",
          "format": "date-time"
        }
      }
    },
    "audit_event": {
      "type": "object",
      "additionalProperties": false,
      "required": ["event_id", "actor_id", "event_type", "target_id", "created_at"],
      "properties": {
        "event_id": {
          "type": "string",
          "pattern": "^[a-z0-9][a-z0-9\\-]*$"
        },
        "actor_id": {
          "type": "string",
          "pattern": "^[a-z0-9][a-z0-9\\-]*$"
        },
        "event_type": {
          "type": "string",
          "enum": ["claim_created", "claim_released", "assignment_updated", "artifact_submitted", "review_added", "status_changed"]
        },
        "target_id": {
          "type": "string",
          "minLength": 1
        },
        "created_at": {
          "type": "string",
          "format": "date-time"
        },
        "details": {
          "type": "string"
        }
      }
    }
  }
}
